title,description,state,lga,status,incidentDate,incidentTime,lat,lng,description_with_more_context,is_duplicate
Banditry Coming to Osun State After Killing in Kwara,"Bandits kill prominent fighter Adisa in Kwara and now target Osun Amotekun leader, signaling expansion of violence into South West.",Osun,Ife Central,High,2025-10-07,12:34,,,"Posts on X indicate a growing threat of banditry extending from Kwara into Osun State in South Western Nigeria. The killing of Adisa, a well-known community fighter in Oke-Odo, Kwara, has raised alarms, with reports suggesting bandits are now aiming at the Amotekun security leader in Osun. This incident highlights the infiltration of armed criminal activities, including potential gunmen attacks and kidnappings, into previously safer areas. The National Security Adviser is urged to act as arms may be entering through backdoors. Such violence disrupts local security, affects farming communities, and could lead to communal clashes. Osun, known for its cultural significance, faces risks of escalation similar to issues in Delta and Rivers, where militancy and cultism prevail. Community leaders express fear over coordinated attacks, calling for enhanced patrols and intelligence to prevent further incidents.",
"Violence in Etsako, Edo: Religious Leaders Killed by Militias","Fulani Islamic militias kill two Reverend Fathers and a Seminarian in Etsako, Edo State, amid ongoing attacks on farmlands.",Edo,Etsako West,High,2025-10-07,15:34,,,"In Etsako area of Edo State, South South Nigeria, social media reports detail the tragic loss of two Reverend Fathers and one Seminarian to attacks by Fulani Islamic militias. The violence includes machete wounds inflicted on victims in their farmlands, preventing locals from accessing agricultural areas due to fear of further assaults. This incident reflects broader herdsmen clashes and insurgency threats in Southern Nigeria, similar to militancy in Delta and cultism in Rivers. Communities report sustained killings and kidnappings, with no immediate security response, leading to displacement. The attacks are described as targeted, disrupting religious and communal life. Edo State, bordering Delta, sees spillover of banditry and armed robbery, exacerbating insecurity. Calls for government intervention grow as such violence undermines social cohesion and economic activities, with potential for escalation into larger communal violence if unaddressed.",
Nigeria Must Investigate Human Rights Violations In South-East – Amnesty Int’l,Amnesty International urges the Nigerian government to investigate human rights abuses in the South-East region amid ongoing security challenges including IPOB-related activities and violence.,Imo,Owerri Municipal,Medium,2025-10-07,13:47,,,"Amnesty International has called on the Nigerian authorities to promptly investigate and address human rights violations occurring in the South-East region of Nigeria. The organization highlighted concerns over excessive use of force by security personnel, arbitrary arrests, and restrictions on movement linked to the Indigenous People of Biafra (IPOB) enforcement of sit-at-home orders. Reports indicate that in recent months, there have been instances of gunmen attacks, kidnappings, and clashes that have exacerbated tensions. The South-East, comprising states like Abia, Anambra, Ebonyi, Enugu, and Imo, has seen a rise in insecurity, with communal violence and armed robberies contributing to the instability. Amnesty emphasized the need for accountability to prevent further escalation, noting that failure to act could lead to more widespread unrest. This call comes in the context of broader national security issues, but focuses on the unique dynamics in the Eastern region where separatist sentiments and enforcement of sit-at-home directives have led to economic disruptions and violent confrontations. Human rights groups have documented cases of police shootings and herdsmen clashes affecting local communities, underscoring the urgency for comprehensive investigations and reforms in security operations.",
COAS raises concern over new major threats to Nigeria’s national security,"The Chief of Army Staff expresses worries about emerging security threats in Nigeria, including insurgency and banditry affecting Eastern regions.",Enugu,Enugu North,High,2025-10-07,15:12,,,"Lieutenant General Taoreed Lagbaja, the Chief of Army Staff, has voiced significant concerns regarding new and evolving threats to Nigeria's national security landscape. Speaking at a recent event, he highlighted the convergence of insurgency, banditry, and communal violence that is increasingly impacting the Eastern part of the country. In the South-East, these threats manifest through IPOB-related sit-at-home enforcements, gunmen attacks on communities, and kidnappings along major highways. The COAS noted that while traditional hotspots like the North-East remain volatile, spillover effects including armed robbery and herdsmen-farmer clashes are straining resources in Eastern states. He called for enhanced intelligence sharing and community engagement to counter these issues. Recent incidents in areas like Enugu and Anambra have involved police shootings during attempts to disperse crowds defying sit-at-home orders, leading to injuries and heightened tensions. The military's role in joint operations with police has been pivotal, but the COAS stressed the need for adaptive strategies to address the sophisticated tactics employed by non-state actors. This statement underscores the interconnected nature of Nigeria's security challenges, with Eastern Nigeria facing unique pressures from separatist activities intertwined with criminal elements.",
"Tinubu invites council of state, police for meeting to address rising insecurity","President Tinubu convenes a meeting with the Council of State and police to tackle escalating insecurity, including issues in Eastern Nigeria such as kidnappings and gunmen attacks.",Abia,Umuahia South,Medium,2025-10-07,13:55,,,"President Bola Tinubu has summoned the Council of State and top police officials for an emergency meeting to strategize on combating the rising wave of insecurity across Nigeria, with particular attention to the Eastern region. The agenda includes discussions on IPOB's sit-at-home orders, which have led to violent enforcements, banditry, and communal clashes in states like Abia and Imo. Recent reports highlight a surge in gunmen attacks on security checkpoints, kidnappings of travelers, and armed robberies disrupting daily life. The President emphasized the need for coordinated efforts to restore peace, especially amid allegations of police shootings in response to unrest. In the South-East, herdsmen incursions have sparked violent confrontations with farmers, exacerbating food insecurity and displacement. This high-level meeting aims to review ongoing operations and propose measures like increased patrols and community policing to mitigate insurgency-like activities. Stakeholders hope this will lead to decisive actions against criminal networks operating under the guise of separatist movements, ultimately aiming to reduce the frequency of violent incidents and rebuild trust in security institutions.",
Hoodlums Beat Lagos Officials at Trade Fair Over Eviction Notice,Lagos State officials were locked out and assaulted by hoodlums at the Trade Fair complex while attempting to enforce an eviction order; police rescued them after the violent confrontation.,Lagos,Ojo,Medium,2025-10-07,13:57,,,"In a tense standoff at the Lagos Trade Fair complex, state government officials faced fierce resistance from traders and hoodlums opposed to an impending eviction. The incident unfolded when officials arrived to inspect the site and issue notices for relocation due to plans to convert the area into residential zones. The group, described as kinsmen of the traders, locked the officials out and subjected them to physical attacks, highlighting ongoing tensions over land use and urban development in Lagos. Police intervention was crucial in extricating the officials unharmed, underscoring the volatile nature of such enforcement actions in densely populated commercial hubs. This event reflects broader challenges in managing informal trading spaces amid rapid urbanization, with potential for escalation into communal violence if not addressed. Authorities have issued prior warnings, including an 18-month notice similar to that given to Ikeja Computer Village traders, but compliance remains low. The clash raises concerns about security in commercial areas, where economic interests clash with government policies, potentially leading to more incidents of this nature.",
Criminal Gangs in Lagos Linked to Alarming Rise in Organ Harvesting,"Posts on social media highlight an increase in violent crimes by criminal gangs operating in Lagos, including organ harvesting cases, amid broader insecurity involving jihadists and secessionists.",Lagos,Ikeja,High,2025-10-07,09:01,,,"Recent discussions on X (formerly Twitter) point to a disturbing surge in criminal activities across southern Nigeria, particularly in Lagos, where gangs are reportedly engaging in organ harvesting. This form of extreme violence is part of a larger tapestry of insecurity that includes jihadist cleansings in Christian communities, secessionist agitations in the East, and organized crime in urban centers like Lagos and Abuja. The post emphasizes that these gangs operate with impunity, contributing to a climate of fear and instability. While specific details on recent incidents are sparse, the mention of 'alarming increase' suggests ongoing investigations or unreported cases that could involve kidnappings and ritual killings. Law enforcement faces challenges in curbing these activities due to the blend of criminality with other insurgent threats. In Lagos, a major economic hub, such crimes not only endanger lives but also deter investment and tourism. Community leaders and security experts call for enhanced policing and intelligence sharing to dismantle these networks. The convergence of various violent elements underscores the need for a coordinated national response to protect vulnerable populations in urban areas.",
Trade Fair Lagos: Traders Resist Eviction with Violence Against Officials,"Traders at Lagos Trade Fair complex resisted eviction notices by locking out state officials and engaging in physical altercations, requiring police rescue amid claims of inadequate relocation plans.",Lagos,Ojo,Medium,2025-10-07,08:19,,,"The Lagos Trade Fair complex, originally intended for exhibitions rather than permanent markets, has become a flashpoint for conflict as the state government pushes for redevelopment into residential areas. Officials dispatched to the site were met with hostility; they were barred entry and assaulted by a group of agitated traders and supporters. This violent response comes after months of official notices urging relocation, drawing parallels to the smoother transition at Ikeja Computer Village where an 18-month grace period was provided. The involvement of police to extract the officials highlights the breakdown in dialogue between authorities and informal traders who rely on the location for livelihood. No arrests were immediately reported, but the incident exposes underlying issues of urban planning, housing shortages, and economic displacement in Lagos. Critics, including opposition figures, argue that the government's approach exacerbates tensions without sufficient support for affected parties. This could signal potential for recurring clashes in similar commercial zones, emphasizing the need for community engagement to prevent escalation into larger-scale communal violence or property damage.",
