title,description,state,lga,status,incidentDate,incidentTime,lat,lng,description_with_more_context,is_duplicate
"Heavy Fighting Between Army and Bandits in Shambo Town, Rijau LGA","Intense gun battle erupts between Nigerian Army and over 300 bandit motorcycles invading from Zamfara, leading to closure of Kontagora-Rijau highway.",Niger,Rijau,High,2025-10-12,06:32,,,"In a major security operation, troops engaged a large bandit horde consisting of more than 300 motorcycles that crossed from Zamfara into Niger State. The clash occurred in Shambo town, Rijau Local Government Area, prompting advisories for travelers to avoid the Kontagora-Rijau highway. Reports indicate the bandits were on a rampage, but military intervention halted their advance. This incident highlights the ongoing spillover of banditry from neighboring Zamfara, exacerbating insecurity in northwestern Nigeria. Local residents are on high alert, with fears of reprisal attacks. The military's response underscores efforts to curb cross-border bandit incursions, though challenges persist due to the vast terrain and mobility of the armed groups. No casualty figures were immediately available, but the scale of the engagement suggests significant confrontation. This event is part of a broader pattern of banditry affecting rural communities, disrupting travel and economic activities in the region.",
Troops Neutralize Boko Haram Terrorists and Rescue Hostages in Borno State,Nigerian troops kill several Boko Haram insurgents along Gajiram-Bolori axis and rescue two elderly captives after intense firefight.,Borno,Guzamala,High,2025-10-12,07:04,,,"In a coordinated operation, troops on motorcycles clashed with Boko Haram terrorists near Zundur village in Borno State, resulting in the elimination of four insurgents who fled into the bush. The engagement extended to the Gajiram, Bolori, Mile 40, and Gajiganna areas, where additional terrorists were neutralized. Among the successes, troops rescued Mr. Modu Kinnami (55) and Mr. Bukar (57) from Guzamala, who had been held captive with a ransom demand of ₦2,000,000 and two new Tecno phones. Seized items included 31 rounds of 7.62mm ammunition, an Itel phone, a dagger, a blue pickup truck, two new Tecno phones, and 30 liters of petrol. One soldier and a vigilante were wounded and evacuated for treatment. The rescued victims were reunited with their families. This operation demonstrates ongoing military efforts against the Boko Haram insurgency in northeastern Nigeria, which continues to pose threats to civilian lives and regional stability despite repeated clearances.",
"Bandits Kill Hausa Wedding Party in Jos, Plateau State","Armed bandits attack and kill a group of 12 Hausa travelers, including women and children, en route to a wedding in Jos.",Plateau,Jos North,High,2025-10-12,05:10,,,"Tragedy struck as bandits ambushed a convoy of 12 individuals from Zaria heading to a wedding in Jos, Plateau State, resulting in the deaths of all victims regardless of gender or age. The attack targeted Hausa travelers, amid claims of ethnic motivations fueled by external propaganda. This incident reflects the escalating communal tensions and banditry in central Nigeria, where innocent civilians are caught in the crossfire of insecurity. Despite military efforts, such random killings continue to sow fear among communities. The perpetrators, described as brainwashed by western influences, highlight the complex interplay of banditry, insurgency, and ethnic strife. Local authorities have yet to confirm details, but the event underscores the urgent need for enhanced security along major routes like Zaria-Jos. Families mourn the loss, with calls for justice and better protection for inter-state travel in volatile areas.",
Bandits Launch Random Attacks Killing Indiscriminately in Northern Nigeria,"Bandits carry out unprovoked shootings killing men, women, children, Christians, and Muslims across Arewa region.",Kaduna,Igabi,High,2025-10-12,04:46,,,"Reports emerge of bandit groups conducting random firing incidents across northern Nigeria, targeting civilians without discrimination based on religion or age. Victims include old men, children, and people of various faiths, pointing to a surge in lawlessness. Sources attribute some attacks to foreign agents, including Mossad, with arrests in Maiduguri confirming external involvement aimed at exploiting resources like gold and uranium. Military operations have neutralized several suspects, but the violence persists, affecting daily life in rural and urban areas alike. This wave of attacks exacerbates the humanitarian crisis, displacing communities and straining security resources. In states like Zamfara and Kaduna, similar patterns of banditry have led to increased calls for federal intervention. The indiscriminate nature of these assaults underscores the breakdown in law and order, with locals expressing frustration over inadequate protection despite ongoing military deployments.",
Nigeria’s Undeclared War: Persecution and Banditry in the North,"US declares religious persecution war in Nigeria, amid ongoing banditry and insurgency tearing at the nation's fabric.",Zamfara,Gusau,High,2025-10-12,04:51,,,"The United States has labeled the violence in Nigeria as a religious war targeting Christians, contradicting Nigerian denials and highlighting the undeclared conflict ravaging the north. Banditry, kidnappings, and clashes between herders and farmers continue unabated in states like Zamfara and Kaduna, displacing millions and crippling agriculture. Insurgent groups like Boko Haram exploit the chaos, while communal violence fuels ethnic divisions. Recent reports detail gunmen attacks and armed robberies, with police shootings adding to the toll. The National Geographic coverage emphasizes the bloody insurgency's impact on Africa's most populous nation, where security forces struggle against resilient threats. Despite government efforts, underreported incidents in local government areas persist, driven by resource conflicts and external influences. This situation demands international attention and robust domestic strategies to restore peace and prevent further escalation into full-scale war.",
IPOB Accused of Sponsoring Killings and Horror in Eastern Nigeria,Social media users blame IPOB for arming criminals and causing widespread killings of security personnel and civilians in the Southeast region.,Imo,Owerri Municipal,High,2025-10-12,06:06,,,"In a heated online discussion, users on X (formerly Twitter) have accused the Indigenous People of Biafra (IPOB) of sponsoring violence in Eastern Nigeria. One post highlights the 'horror' experienced by locals due to IPOB's alleged involvement in killings, forming camps, and targeting brothers in the region. Critics argue that IPOB's actions, including arming criminals to attack security forces, have led to significant unrest. This comes amid ongoing 'sit-at-home' orders enforced by IPOB, which have paralyzed economic activities and heightened tensions. Reports suggest that such sponsorship has exacerbated insecurity, with unknown gunmen linked to the group carrying out attacks. The sentiment reflects frustration among residents who lived through these events, pinning the blame on external influencers and traitors. While IPOB denies involvement in violence, focusing on self-determination, these accusations point to a cycle of retaliation and communal discord in states like Imo and Anambra. Security forces have responded with operations, but the root causes of insurgency and separatist agitations remain unresolved, contributing to a volatile environment in Eastern Nigeria over the past years.",
IPOB Labeled Worst Human Beings for Arming Criminals Against Security in Southeast,"Posts on X condemn IPOB for providing arms to criminals, resulting in attacks on security personnel across Eastern Nigeria.",Anambra,Awka South,High,2025-10-12,05:46,,,"Online discourse on X has intensified criticism against IPOB, with users describing the group as 'the worst of human beings' for allegedly arming criminals to target security forces in the Southeast. This follows a pattern of gunmen attacks attributed to IPOB enforcers during 'sit-at-home' protests, leading to deaths of police and military personnel. The post questions what IPOB expected after such actions, highlighting the backlash from the Nigerian government and local communities. In Eastern states, these incidents have fueled communal violence and insurgency-like activities, disrupting daily life and commerce. Kidnappings and armed robberies have also surged in the vacuum created by these clashes. While some defend IPOB's agitation for Biafran independence, others see it as a cover for criminality. Security analysts note that the proliferation of arms in the region stems from unresolved grievances, including marginalization and economic hardship. Recent operations by Ebubeagu security outfit, backed by state governments, aim to counter these threats, but reports of extrajudicial killings complicate the narrative. The overall security situation in Eastern Nigeria remains tense, with calls for dialogue to address underlying issues.",
Ebubeagu Militia Blamed for Killings in Eastern Nigeria Amid IPOB Tensions,X users point to Ebubeagu and other armed militias funded by politicians as perpetrators of crimes pinned on IPOB in the East.,Ebonyi,Abakaliki,High,2025-10-12,04:46,,,"A post on X challenges the narrative blaming IPOB for all violence in Eastern Nigeria, instead accusing Ebubeagu, a regional security outfit, and other politician-funded militias of carrying out killings. The user questions when such groups last faced blame from critics, noting their recruitment to pin crimes on IPOB. This reflects broader communal violence and police shootings in states like Ebonyi and Enugu, where herdsmen clashes and insurgency elements intersect with separatist activities. The 'sit-at-home' orders by IPOB have been exploited by criminals for armed robbery and kidnappings, but the post argues that state-backed groups exacerbate the insecurity. Reports indicate that these militias, formed to combat unknown gunmen, have themselves been implicated in extrajudicial actions and clashes with locals. The security landscape in Eastern Nigeria is marked by a mix of insurgency, banditry, and political violence, with over 100 incidents reported in recent months leading to fatalities and displacements. National efforts to regulate private security and enhance intelligence are underway, but grassroots tensions persist. Social media amplifies these voices, calling for accountability from all sides to curb the cycle of violence.",
Escalating Violence in Southeast: Bandits and Terrorists Marauding Amid Government Inaction,"A user on X describes Nigeria's choice between poisons as bandits and terrorists destroy lives in the Southeast, urging alternative security measures.",Abia,Umuahia South,High,2025-10-12,02:35,,,"In a poignant X post, a user portrays the dire security situation in Eastern Nigeria, where bandits and terrorists are 'marauding' the Southeast, destroying lives without adequate government response. The post criticizes President Tinubu for failing to address the calamity, suggesting people must seek alternatives. This echoes ongoing issues like IPOB-enforced sit-at-home, gunmen attacks, and kidnappings that have gripped the region. In Imo and Abia, communal violence between herders and farmers has intertwined with insurgency, leading to armed clashes and police interventions. The lack of effective countermeasures has led to mass fear, with businesses shuttered and schools closed during enforcement periods. Security reports indicate a rise in violent crimes, including over 50 kidnappings in the past month alone. While federal forces conduct raids, locals feel abandoned, turning to vigilante groups that sometimes fuel further unrest. The post's call for action highlights the humanitarian crisis, with displaced persons and economic losses mounting. Broader context includes national debates on declaring states of emergency in volatile areas to restore order, but implementation remains contentious in the Southeast due to separatist sentiments.",
"Heavy Fighting Between Army and Bandits in Rijau LGA, Niger State","Intense clash between Nigerian Army and over 300 bandits on motorcycles in Shambo town, leading to closure of Kontagora-Rijau highway.",Niger,Rijau,High,2025-10-12,06:32,,,"Reports from social media indicate a major security operation in Shambo town, Rijau Local Government Area of Niger State, where the Nigerian Army engaged a large group of bandits numbering over 300 on motorcycles. The bandits reportedly moved from Zamfara State two days prior, escalating tensions in the region. The confrontation resulted in significant gunfire exchanges, prompting the temporary closure of the Kontagora-Rijau highway to ensure traveler safety. Local sources advise caution for those traveling in the area. This incident highlights the ongoing banditry challenges spilling over from neighboring Zamfara into Niger State, affecting communities and disrupting daily life. Military efforts continue to pursue the fleeing bandits, with no immediate casualty figures released. The event underscores the persistent insecurity in Northern Nigeria, where bandit groups frequently launch cross-border raids, contributing to displacement and economic hardship in rural areas.",
Troops Neutralize Boko Haram Terrorists and Rescue Hostages in Borno State,Nigerian troops killed several Boko Haram insurgents near Zundur village and rescued two elderly captives after a fierce gun battle.,Borno,Guzamala,High,2025-10-12,07:04,,,"In a coordinated operation along the Gajiram, Bolori, Mile 40, and Gajiganna axis in Borno State, troops on motorcycles clashed with Boko Haram terrorists near Zundur village. The engagement resulted in the neutralization of four terrorists, who fled into the surrounding bush. Additionally, troops rescued two elderly men, Mr. Modu Kinnami (55) and Mr. Bukar (57), from Guzamala, who had been held captive and were to be ransomed for N2 million and two new Tecno phones. The operation also led to the seizure of a blue pickup truck, two new Tecno phones, a jerrycan of 30 liters of petrol, 31 rounds of 7.62mm ammunition, an Itel phone, and a dagger. One soldier and a vigilante were injured and evacuated for treatment. The rescued victims were reunited with their families. This incident reflects the ongoing insurgency in Northeast Nigeria, where Boko Haram continues to pose threats through kidnappings and ambushes, despite military advances. Such operations demonstrate efforts to curb the group's activities, but the region remains volatile with frequent attacks on civilians and security forces.",
Bandits Kill Travelers from Zaria in Jos Ambush,"Bandits ambushed and killed a family of travelers from Zaria en route to a wedding in Jos, targeting Hausa individuals.",Plateau,Jos South,High,2025-10-12,04:46,,,"Social media posts report a tragic incident where bandits killed an entire family traveling from Zaria to a wedding in Jos. The victims, including males, females, and two children, were targeted due to their Hausa ethnicity. The attack occurred despite ongoing military efforts to combat banditry in the region. This event has sparked outrage and highlights ethnic tensions exacerbated by insecurity in Plateau State. The killings are described as random, affecting both Christians and Muslims, but with underlying propaganda influences. Broader context reveals persistent banditry in Northern Nigeria, where groups operate with impunity, leading to loss of lives and communal distrust. Military operations continue, but such incidents underscore the need for enhanced security measures along major routes like Zaria-Jos. The post emphasizes that no community supports banditry, yet the cycle of violence persists, fueled by external factors including alleged foreign influences seeking resources like gold and uranium.",
Nigeria’s Undeclared War: Persecution of Christians in Northern Nigeria,US declares religious war in Nigeria targeting Christians amid ongoing banditry and insurgency in the North.,Zamfara,Gusau,High,2025-10-12,04:51,,,"A recent article discusses the United States' declaration of a religious war in Nigeria, specifically the persecution of Christians, contradicting Nigerian government denials. The piece highlights an 'undeclared war' involving banditry, insurgency, and communal violence in Northern states like Zamfara and Kaduna. Incidents include attacks by gunmen and herdsmen clashes that disproportionately affect Christian communities, leading to deaths and displacements. The article criticizes Western involvement, alleging support for groups behind the violence to exploit resources. It mentions captures of foreign agents in Maiduguri by the military. This broader conflict tears at Nigeria's social fabric, with recent escalations in the past day involving random killings of civilians regardless of faith. The situation calls for international attention, as local efforts struggle against resilient armed groups. Security challenges encompass kidnappings, armed robberies, and police responses, creating a humanitarian crisis in the region.",
Residents Report Horror from IPOB-Sponsored Killings in Eastern Nigeria,"Local accounts describe ongoing violence and killings attributed to IPOB activities, including the formation of camps and sponsorship of attacks against brothers and security forces in the Southeast region.",Anambra,Onitsha South,High,2025-10-12,06:06,,,"In recent social media discussions, residents of Eastern Nigeria have expressed outrage over what they perceive as IPOB's role in escalating violence through sponsorship of killings and the establishment of militant camps. One account highlights the 'horror we lived in,' pointing to targeted attacks on civilians and security personnel, which have created a climate of fear and division. This comes amid ongoing separatist agitations and the controversial sit-at-home orders enforced by IPOB, leading to economic disruptions and sporadic clashes. Critics argue that external influences and traitorous elements are fueling these incidents, exacerbating communal tensions. The violence has reportedly resulted in numerous fatalities, with accusations flying between IPOB supporters and local authorities. Security forces have been drawn into the fray, responding to ambushes and gunmen attacks. This situation underscores the broader insecurity in the Southeast, where insurgency-like activities blend with criminal elements, affecting daily life and prompting calls for dialogue. Reports suggest that such incidents are part of a pattern of armed confrontations that have persisted, contributing to instability in states like Anambra. The international community has noted the humanitarian impact, but local voices dominate the narrative of betrayal and loss.",
IPOB Accused of Arming Criminals for Attacks on Security Personnel in Southeast,"Social media users condemn IPOB for allegedly arming criminals responsible for killing security personnel, highlighting the group's role in worsening violence in Eastern Nigeria.",Imo,Owerri Municipal,High,2025-10-12,05:46,,,"Posts on social media platforms reveal growing frustration with IPOB's purported involvement in arming criminal elements to target security forces in Nigeria's Southeast. Users describe IPOB as 'the worst of human beings' for enabling these attacks, which have led to the deaths of numerous officers and civilians alike. This criticism arises in the context of the group's enforcement of sit-at-home orders, which have been linked to gunmen attacks and kidnappings in the region. The violence is seen as a direct response to government crackdowns, but locals argue it disproportionately harms innocent communities. Incidents include ambushes on police convoys and communal clashes fueled by separatist rhetoric. In Imo State, such activities have intensified, with reports of armed robberies and insurgency-style operations disrupting normalcy. The backlash includes calls for accountability, as the arming of militants is believed to perpetuate a cycle of retaliation and fear. Broader security challenges, such as herdsmen clashes and banditry spillover, compound the issue, but IPOB's actions are singled out for their ideological drive. This has resulted in high casualties, economic paralysis during enforced lockdowns, and a deepening trust deficit between the people and both separatists and authorities. Efforts to restore peace remain hampered by ongoing hostilities.",
Debate Rages Over Blame for Ebubeagu Killings Pinned on IPOB in Eastern States,"Online discourse questions the attribution of killings by Ebubeagu militia to IPOB, amid claims that politicians fund armed groups to destabilize the East through fabricated crimes.",Ebonyi,Abakaliki,High,2025-10-12,04:46,,,"A heated online debate in Eastern Nigeria centers on the responsibility for recent killings attributed to the Ebubeagu security outfit, with many arguing that IPOB is being scapegoated by rogue politicians. Social media users point out the lack of criticism directed at state governors for funding these militias, which are accused of targeting civilians and pinning crimes on separatists. This narrative emerges against a backdrop of communal violence, police shootings, and gunmen attacks that have plagued the region. In Ebonyi State, such incidents have led to fatalities and heightened tensions, blending political motivations with ethnic strife. Reports suggest that armed robberies and kidnappings are exacerbated by these proxy conflicts, creating an environment ripe for insurgency. The sit-at-home orders by IPOB are cited as a flashpoint, but defenders claim they are peaceful, while aggressors use them as cover for violence. The involvement of funded militias like Ebubeagu is seen as a strategy to discredit the independence movement, resulting in clashes that displace communities and erode social fabric. Security analysts note that this misattribution fuels further unrest, with high-severity outcomes including deaths and injuries. Calls for transparency and cessation of political interference are growing, as the East grapples with multifaceted threats including herdsmen incursions and internal banditry.",
Southeast Faces Escalating Threats from Bandits and IPOB-Linked Violence,"Users highlight the spread of banditry and terrorist activities into the Southeast, criticizing the government's failure to address the security crisis amid IPOB agitations.",Enugu,Enugu North,High,2025-10-12,02:35,,,"Social media commentary warns of the convergence of banditry, insurgency, and IPOB-related violence encroaching on Nigeria's Southeast, with users decrying the president's inaction. Descriptions paint a picture of marauding armed groups destroying lives across the region, including gunmen attacks and kidnappings that mirror northern conflicts. In Enugu State, this hybrid threat has led to increased communal violence and police confrontations, with sit-at-home enforcements providing opportunities for criminal exploitation. The posts emphasize that Nigerians cannot afford to accept this calamity, as clashes between herders and farmers, armed robberies, and separatist skirmishes intensify. High fatality rates from these incidents underscore the severity, with entire communities under threat. Critics argue for alternative security measures, as federal responses fall short, allowing insurgents and bandits to thrive. This situation is part of a national insecurity wave, but the Southeast's unique blend of ideological and criminal violence sets it apart, leading to economic stagnation and mass fear. Reports of police shootings in response to attacks further escalate tensions, while underreported areas suffer silently. The call is for decisive action to prevent total breakdown, highlighting the mental toll on residents amid ongoing horrors.",
Nigerian Army Troops Rescue More Kidnapped Victims in Kwara State,"Troops of 2 Division/Sector 3, Operation FANSAN YAMMA, rescued three kidnapped victims in Babanla Forest, Kwara State, as part of ongoing operations against bandits.",Kwara,Moro,Medium,2025-10-12,05:46,,,"In a continued effort to combat banditry and kidnapping in Northern Nigeria, troops from the Nigerian Army's 2 Division/Sector 3 under Operation FANSAN YAMMA conducted aggressive patrols in the Babanla Forest area of Kwara State. Acting on credible intelligence, the troops successfully rescued three more victims who had been abducted by bandits. This operation follows previous rescues in the region and demonstrates the military's commitment to restoring security in areas plagued by criminal activities. The victims were safely evacuated, and no casualties were reported among the troops. Banditry in Kwara and surrounding states has been a persistent issue, involving kidnappings for ransom and attacks on communities. The army has intensified its onslaught against these criminal elements, with multiple rescues in recent days. Local residents have expressed relief, but call for sustained efforts to prevent future incidents. This event highlights the broader security challenges in North-Central Nigeria, where forested areas serve as hideouts for bandits operating across state borders.",
