title,description,state,lga,status,incidentDate,incidentTime,lat,lng,description_with_more_context,is_duplicate
Bandits Kill Groom and Abduct Bride in Zamfara State,"Bandits raided a wedding in Zamfara State, killing the groom and abducting the bride along with other guests.",Zamfara,Gusau,High,2025-10-06,18:00,,,"Violence marred a wedding celebration in Zamfara State as bandits stormed the event, resulting in the death of the groom and the kidnapping of the bride and several other attendees. This brazen attack exemplifies the deteriorating security situation in Northern Nigeria, where criminal elements increasingly target social gatherings for extortion and terror. The incident has sparked outrage among locals, who fear that no event or community is safe from such incursions. Zamfara, a hotspot for banditry, has seen a surge in kidnappings and killings, often linked to armed groups controlling swathes of rural territory. Reports indicate that the attackers arrived on motorcycles and opened fire indiscriminately before making off with their captives. Community leaders and residents are calling for immediate military intervention to rescue the victims and dismantle bandit networks. This tragedy not only devastates families but also erodes trust in state security apparatus, contributing to widespread displacement and economic stagnation in the region. Similar patterns of violence, including herdsmen clashes and insurgency remnants, persist across neighboring states like Kaduna.",
Demolition and Destruction of Igbo Businesses in Lagos Sparks Communal Tensions,"Reports indicate that businesses and buildings owned by Igbos in Lagos are being demolished and destroyed by Yoruba groups and politicians, leading to heightened communal violence.",Lagos,Ojo,Medium,2025-10-06,23:07,,,"In recent developments in Lagos, Nigeria, there have been reports of escalating communal tensions where properties belonging to the Igbo community are being targeted for demolition and destruction. Social media posts highlight that Yoruba tribesmen and politicians are allegedly involved in these acts, which are perceived as ethnically motivated. This incident aligns with broader security concerns in Western Nigeria, including communal violence and property damage. The destruction has provoked outrage among residents, potentially leading to further clashes. While specific details on casualties are not mentioned, the economic impact on affected business owners is significant, disrupting livelihoods in a major commercial hub like Lagos. Authorities have yet to issue an official response, but such events underscore the fragility of inter-ethnic relations in urban centers. This could be linked to ongoing disputes over land and business spaces, reminiscent of past incidents in markets like Tradefair, where shops have been burnt or demolished amid similar tensions. The situation calls for intervention to prevent escalation into wider violence, as Nigeria grapples with multiple security challenges including banditry and kidnappings in other regions.",
Bandits Kill Groom and Abduct Bride in Zamfara State,Gunmen bandits killed a groom and abducted his bride along with others during a wedding-related incident in Zamfara State.,Zamfara,Gusau,High,2025-10-06,18:00,,,"Tragedy struck in Zamfara State as bandits invaded a community, resulting in the death of a groom and the kidnapping of his bride and several others. The attack, which occurred amid celebrations, has sent shockwaves through the region, illustrating the brazen nature of criminal elements operating in Northern Nigeria. Reports indicate that the assailants opened fire indiscriminately, leading to the fatal shooting of the groom before bundling the victims onto motorcycles and fleeing into the bush. This incident is part of a surge in banditry targeting civilians in Zamfara, where communities live in constant fear. The state government has condemned the attack and promised to pursue the perpetrators, but skepticism remains high among locals due to past unfulfilled pledges. The kidnapping of women and children has become a tactic to exert control and generate revenue through ransoms, further destabilizing the area. Humanitarian organizations are mobilizing support for affected families, while calls grow for enhanced intelligence sharing between states to curb cross-border bandit movements. This event highlights the intersection of cultural events and insecurity, disrupting social fabric in the Northwest.",
Bandits Overrun Troops in Kwara State,"Reports emerge of Fulani bandits overrunning Nigerian army troops in Kwara State, seizing weapons and forcing residents to flee.",Kwara,Moro,High,2025-10-06,19:00,,,"Amid rising insecurity, unverified reports indicate that bandits overran a military position in Kwara State, carting away machine guns and ammunition. The incident has sparked panic among locals, with many abandoning their homes in fear of reprisal attacks. While the Nigerian Army has denied the claims, describing them as false, social media buzz and eyewitness accounts suggest a fierce confrontation occurred, highlighting vulnerabilities in security operations. Kwara, increasingly affected by spillover banditry from neighboring states like Zamfara and Niger, faces threats from armed groups infiltrating forested areas. This event, if confirmed, would represent a significant blow to counter-insurgency efforts, potentially emboldening criminals. Community leaders are demanding transparency and reinforced deployments to protect border communities. The broader context involves a pattern of attacks on security personnel across Northern Nigeria, where bandits employ superior firepower and local knowledge. Economic activities, including farming and trade, are halted, contributing to regional instability. Urgent calls for intelligence upgrades and community policing are rising to prevent further escalations.",
Fire Guts Section of Rivers State Secretariat Amid Rising Security Concerns,"A fire outbreak occurred at the Rivers State Secretariat, with no casualties reported, but it raises questions about security lapses in government facilities prone to criminal activities.",Rivers,Port Harcourt,Low,2025-10-06,20:08,,,"On October 6, 2025, a fire broke out at the Ground Floor of the Podium Block in the Rivers State Secretariat, Port Harcourt. The Head of Service, Dr. Mrs. Inyingi S. I. Brown, confirmed the incident and stated there were no casualties. Firefighters responded promptly to contain the blaze, which damaged property but did not spread further. While the cause is under investigation, such events in Rivers State, known for cultism, militancy, and communal violence, often intersect with security issues. The state has seen frequent gunmen attacks, kidnappings, and armed robberies, particularly in areas like Port Harcourt and surrounding LGAs. This fire, though not directly violent, highlights vulnerabilities in public infrastructure that could be exploited by criminal elements. In the context of broader insecurity, including herdsmen clashes in rural areas and police shootings in urban centers, incidents like this test the state's emergency response capabilities. Residents and officials are urging enhanced security measures to prevent sabotage or related criminal acts, as Rivers remains a hotspot for oil-related militancy and cult activities in Southern Nigeria.",
Kwara Government Denies Bandits Control Over Any LGA Amid Security Concerns,"The Kwara State government refutes claims by Peter Obi that bandits have taken control of local government areas, calling the assertions reckless and false.",Kwara,Ilorin South,Low,2025-10-06,21:28,,,"Amid rising concerns over banditry spreading to Kwara State, the government has firmly denied reports suggesting that bandits have overrun troops or seized control of any local government area. This statement comes in response to claims made by opposition figure Peter Obi, which the administration labeled as misleading and intended to incite panic. Recent rumors circulated on social media about bandits overpowering security forces in areas like Obanla and carting away weapons, but official sources confirm these are fabrications. The state government emphasized ongoing efforts by security agencies to maintain order, including joint operations with the Nigerian Army. Despite the denial, underlying worries persist as banditry from neighboring states like Zamfara and Niger threatens to infiltrate Kwara's borders. Residents in border communities report increased vigilance, and the government has assured the public of enhanced patrols. This episode highlights the challenge of misinformation in amplifying security fears in Northern Nigeria, where real threats from armed groups continue to evolve. Authorities urge citizens to rely on verified information to avoid unnecessary alarm.",
